adult,budget,homepage,id,imdb_id,original_language,original_title,overview,popularity,poster_path,release_date,revenue,runtime,status,tagline,title,video,vote_average,vote_count
False,46000000,,479,tt0162650,en,Shaft,"New York police detective John Shaft arrests Walter Wade Jr. for a racially motivated slaying. But the only eyewitness disappears, and Wade jumps bail for Switzerland. Two years later Wade returns to face trial, confident his money and influence will get him acquitted -- especially since he's paid a drug kingpin to kill the witness.",7.420019,/bqlpFp96uWu2VDpsm4MVvLXdumh.jpg,2000-06-15,107196498,99.0,Released,"Still the man, any questions?",Shaft,False,5.5,316
False,2142000,,494,tt0070679,en,Shaft in Africa,"Detective John Shaft travels incognito to Ethiopia, then France, to bust a human trafficking ring.",1.424722,/fY5SLWGJTd50f2TsHokvXBOywQG.jpg,1973-06-14,1458000,112.0,Released,Shaft is stickin' it...all the way.,Shaft in Africa,False,5.4,6
False,1978000,,493,tt0069257,en,Shaft's Big Score!,John Shaft is back as the lady-loved black detective cop on the search for the murderer of a client.,0.760855,/jioGhMgP8d7eu1G7YT7xeyLOJuc.jpg,1972-06-08,10000000,104.0,Released,Last time he was nice. This time he's ice!,Shaft's Big Score!,False,6.1,7
False,0,,93,tt0052561,en,Anatomy of a Murder,"The film pits a humble small-town lawyer against a hard-headed big city prosecutor. Emotions flare as a jealous army lieutenant pleads innocent to murdering the rapist of his seductive, beautiful wife.",9.473772,/kDFnM2zlHZirR2ItTo56lyrxuAS.jpg,1959-07-01,0,160.0,Released,"No search of human emotions has ever probed so deeply, so truthfully as ... Anatomy of a Murder.",Anatomy of a Murder,False,7.7,207
False,60000000,,786,tt0181875,en,Almost Famous,"Almost Famous is an autobiographical inspired film about a 15-year-old who is hired by Rolling Stone magazine to follow and interview a rock band during their tour. A film about growing up, first love, disappointment, and the life of a rock star.",9.086699,/9pNo92j6zSEAUB8pNmcJTkpnkBF.jpg,2000-09-15,47383689,122.0,Released,Experience it. Enjoy it. Just don't fall for it.,Almost Famous,False,7.4,807
False,12800000,,16,tt0168629,en,Dancer in the Dark,"Selma, a Czech immigrant on the verge of blindness, struggles to make ends meet for herself and her son, who has inherited the same genetic disorder and will suffer the same fate without an expensive operation. When life gets too difficult, Selma learns to cope through her love of musicals, escaping life's troubles - even if just for a moment - by dreaming up little numbers to the rhythmic beats of her surroundings.",10.684806,/7xizDTz4Yj4IYm2ud4f6EfEXe5H.jpg,2000-05-17,40031879,140.0,Released,You don't need eyes to see.,Dancer in the Dark,False,7.7,392
False,0,,469,tt0088184,en,Stranger Than Paradise,"Rootless Hungarian émigré Willie, his pal Eddie, and visiting sixteen-year-old cousin Eva always manage to make the least of any situation, whether aimlessly traversing the drab interiors and environs of New York City, Cleveland, or an anonymous Florida suburb.",11.33706,/Ett7TAy9y5R0p08REDgErVmLPf.jpg,1984-10-01,0,89.0,Released,,Stranger Than Paradise,False,7.4,112
False,0,,911,tt0032234,en,The Bank Dick,"Egbert Sousé becomes an unexpected hero when a bank robber falls over a bench he's occupying. Now considered brave, Egbert is given a job as a bank guard. Soon, he is approached by charlatan J. Frothingham Waterbury about buying shares in a mining company. Egbert persuades teller Og Oggilby to lend him bank money, to be returned when the scheme pays off. Unfortunately, bank inspector Snoopington then makes a surprise appearance.",1.423358,/dUKVnfOKeK68uNY2Iugc29bY2gN.jpg,1940-11-29,0,72.0,Released,"Was His Face Red . . . And His Nose, Too ! when the bandits took the money . . . and the SAFE !",The Bank Dick,False,6.8,28
False,4500000,http://www.requiemforadream.com/,641,tt0180093,en,Requiem for a Dream,The hopes and dreams of four ambitious people are shattered when their drug addictions begin spiraling out of control. A look into addiction and how it overcomes the mind and body.,6.874828,/muym4jTjdLx7E6as09d1wlC3sOB.jpg,2000-10-27,7390108,102.0,Released,,Requiem for a Dream,False,7.9,2525
False,5000000,,71,tt0249462,en,Billy Elliot,"Set against the background of the 1984 Miner's Strike, Billy Elliot is an 11 year old boy who stumbles out of the boxing ring and onto the ballet floor. He faces many trials and triumphs as he strives to conquer his family's set ways, inner conflict, and standing on his toes!",12.158424,/6VaP1H3MOW5jdkWqS5Q1NapCOS6.jpg,2000-05-18,110000000,110.0,Released,Inside every one of us is a special talent waiting to come out. The trick is finding it.,Billy Elliot,False,7.4,774
False,7200000,http://www.mgm.com/view/movie/529/Diamonds-Are-Forever/,681,tt0066995,en,Diamonds Are Forever,Diamonds are stolen only to be sold again in the international market. James Bond infiltrates a smuggling mission to find out who’s guilty. The mission takes him to Las Vegas where Bond meets his archenemy Blofeld.,12.00491,/viPjZ3JCOahcfNCcVhiPExusJoZ.jpg,1971-12-13,116019547,120.0,Released,The man who made 007 a household number,Diamonds Are Forever,False,6.3,562
False,17000000,,146,tt0190332,zh,卧虎藏龙,"Two warriors in pursuit of a stolen sword and a notorious fugitive are led to an impetuous, physically-skilled, teenage nobleman's daughter, who is at a crossroads in her life.",19.944953,/2D7kikHUHbecJGoRAspBYiqoxd6.jpg,2000-10-01,213525736,120.0,Released,"A timeless story of strength, secrets and two warriors who would never surrender.","Crouching Tiger, Hidden Dragon",False,7.2,949
False,40000000,http://www.mgm.com/view/movie/1132/The-Living-Daylights/,708,tt0093428,en,The Living Daylights,James Bond helps a Russian General escape into the west. He soon finds out that the KGB wants to kill him for helping the General. A little while later the General is kidnapped from the Secret Service leading 007 to be suspicious.,12.189038,/yEryMe58dx7zm1QBhQFeuYcv2aH.jpg,1987-06-29,191185897,130.0,Released,Licensed to thrill.,The Living Daylights,False,6.2,447
False,10000000,,107,tt0208092,en,Snatch,"The second film from British director Guy Ritchie. Snatch tells an obscure story similar to his first fast-paced crazy character-colliding filled film “Lock, Stock and Two Smoking Barrels.” There are two overlapping stories here – one is the search for a stolen diamond, and the other about a boxing promoter who’s having trouble with a psychotic gangster.",14.014025,/on9JlbGEccLsYkjeEph2Whm1DIp.jpg,2000-09-01,83557872,103.0,Released,Stealin' Stones and Breakin' Bones.,Snatch,False,7.7,2953
False,25000000,,392,tt0241303,en,Chocolat,"A fable of emotional liberation and chocolate. A mother and daughter move to a small French town where they open a chocolate shop. The town, religious and morally strict, is against them as they represent free-thinking and indulgence. When a group of Boat Gypsies float down the river the prejudices of the Mayor leads to a crisis.",8.9256,/qVKYduwLJ5HjbeVVYqYPSAhWQqh.jpg,2000-12-14,152500343,121.0,Released,...and the world is still indulging!,Chocolat,False,6.8,979
False,43000000,,711,tt0181536,en,Finding Forrester,Gus van Sant tells the story of a young African American man named Jamal who confronts his talents while living on the streets of the Bronx. He accidentally runs into an old writer named Forrester who discovers his passion for writing. With help from his new mentor Jamal receives a scholarship to a private school.,10.536255,/heHi6n68fDiQoUc7SMletM9Adjz.jpg,2000-12-21,80049764,136.0,Released,"In an ordinary place, he found the one person to make his life extraordinary.",Finding Forrester,False,7.0,305
False,26000000,,134,tt0190590,en,"O Brother, Where Art Thou?","In the deep south during the 1930s, three escaped convicts search for hidden treasure while a relentless lawman pursues them. On their journey they come across many comical characters and incredible situations. Based upon Homer's 'Odyssey'.",12.434175,/eIqSzq6j3yuxNmifiUOh6iTpG9N.jpg,2000-08-30,71868327,106.0,Released,They have a plan...but not a clue.,"O Brother, Where Art Thou?",False,7.3,1144
False,20000000,,96,tt0092644,en,Beverly Hills Cop II,"Detroit cop, Axel Foley heads for the land of sunshine and palm trees to find out who shot police Captain Andrew Bogomil. Thanks to a couple of old friends, Axel's investigation uncovers a series of robberies masterminded by a heartless weapons kingpin – and the chase is on.",9.200336,/2y1z1baxKT0coTTRlnkI6McnR9f.jpg,1987-05-18,299965036,100.0,Released,,Beverly Hills Cop II,False,6.1,627
False,15000000,,90,tt0086960,en,Beverly Hills Cop,"Tough-talking Detroit cop Axel Foley heads to the rarified world of Beverly Hills in his beat-up Chevy Nova to investigate a friend's murder. But soon, he realizes he's stumbled onto something much more complicated. Bungling rookie detective Billy Rosewood joins the fish-out-of-water Axel and shows him the West Los Angeles ropes.",8.503483,/s7n0rS2Ff85SuSpqYG3ndkmdQf4.jpg,1984-11-29,316360478,105.0,Released,The Heat Is On!,Beverly Hills Cop,False,6.8,985
False,350000,,764,tt0083907,en,The Evil Dead,"When a group of college students finds a mysterious book and recording in the old wilderness cabin they've rented for the weekend, they unwittingly unleash a demonic force from the surrounding forest.",10.421679,/fA7uqS8ZBzCVPKgB7rFaR0wTFpy.jpg,1981-10-15,29400000,85.0,Released,The Ultimate Experience In Grueling Terror,The Evil Dead,False,7.3,913
False,23000000,,580,tt0093300,en,Jaws: The Revenge,"After another deadly shark attack, Ellen Brody decides she has had enough of New England's Amity Island and moves to the Caribbean to join her son, Michael, and his family. But a great white shark has followed her there, hungry for more lives.",9.327986,/ssDizT0itTUaAdHoVrxRElo7Q1A.jpg,1987-07-17,51881013,89.0,Released,"This time, it’s personal.",Jaws: The Revenge,False,3.5,227
False,0,http://www.wkw-inthemoodforlove.com/,843,tt0118694,cn,花樣年華,A melancholy story about the love between a woman and a man who live in the same building and one day find out that their husband and wife had an affair with each other. More and more the two meet during their daily lives as they determine that they both don’t want to be lonely in their marriage.,8.703552,/unOW3SxFxBdd7LMWjmRONdHWKPb.jpg,2000-05-22,12854953,98.0,Released,"Feel the heat, keep the feeling burning, let the sensation explode.",In the Mood for Love,False,7.8,379
False,8000000,,318,tt0120753,en,The Million Dollar Hotel,The Million Dollar Hotel starts with a jump from a roof top that clears up a death in a hotel that was burning to the ground where a lot of strange people had been living.,4.938231,/4wxOzpCjXY2RQgS3YoHuvKdItTF.jpg,2000-02-09,0,122.0,Released,,The Million Dollar Hotel,False,5.9,76
False,68000000,,853,tt0215750,en,Enemy at the Gates,Enemy at the Gates is a war film from Jean-Jacques Annaud from 2001 that takes place during the battle of Stalingard in World War II between the Russians and the Germans.,10.704813,/dOWSbEn3ucyoiBE9IgFWAo1O7Sg.jpg,2001-03-13,96976270,131.0,Released,Some Men Are Born To Be Heroes.,Enemy at the Gates,False,7.2,1023
False,9000000,http://www.otnemem.com/,77,tt0209144,en,Memento,"Suffering short-term memory loss after a head injury, Leonard Shelby embarks on a grim quest to find the lowlife who murdered his wife in this gritty, complex thriller that packs more knots than a hangman's noose. To carry out his plan, Shelby snaps Polaroids of people and places, jotting down contextual notes on the backs of photos to aid in his search and jog his memory. He even tattoos his own body in a desperate bid to remember.",15.450789,/fQMSaP88cf1nz4qwuNEEFtazuDM.jpg,2000-10-11,39723096,113.0,Released,Some memories are best forgotten.,Memento,False,8.1,4168
False,2000000,,55,tt0245712,es,Amores perros,Three different people in Mexico City are catapulted into dramatic and unforeseen circumstances in the wake of a terrible car crash: a young punk stumbles into the sinister underground world of dog fighting; an injured supermodel's designer pooch disappears into the apartment's floorboards; and an ex-radical turned hit man rescues a gunshot Rotweiler.,5.958138,/8gEXmIzw1tDnBfOaCFPimkNIkmm.jpg,2000-06-16,20908467,154.0,Released,Love. Betrayal. Death.,Amores perros,False,7.6,537
False,25000000,,634,tt0243155,en,Bridget Jones's Diary,"A chaotic Bridget Jones meets a snobbish lawyer, and he soon enters her world of imperfections.",10.780524,/f6z20eozbI7IvvFQfhQzuXoyo7Y.jpg,2001-04-13,281929795,97.0,Released,Health Warning: Adopting Bridget's lifestyle could seriously damage your health.,Bridget Jones's Diary,False,6.6,1397
False,25000000,,111,tt0086250,en,Scarface,"After getting a green card in exchange for assassinating a Cuban government official, Tony Montana stakes a claim on the drug trade in Miami. Viciously murdering anyone who stands in his way, Tony eventually becomes the biggest drug lord in the state, controlling nearly all the cocaine that comes through Miami. But increased pressure from the police, wars with Colombian drug cartels and his own drug-fueled paranoia serve to fuel the flames of his eventual downfall.",11.299673,/zr2p353wrd6j3wjLgDT4TcaestB.jpg,1983-12-08,65884703,170.0,Released,The world is yours...,Scarface,False,8.0,3017
False,27000000,,849,tt0085811,en,Krull,A prince and a fellowship of companions set out to rescue his bride from a fortress of alien invaders who have arrived on their home planet.,9.848674,/xini4pJHApNdYO1go39BmIvBdLT.jpg,1983-07-29,16519460,117.0,Released,A world light-years beyond your imagination.,Krull,False,5.8,130
False,0,,934,tt0048021,fr,Du rififi chez les hommes,"Out of prison after a five-year stretch, jewel thief Tony (Jean Servais) turns down a quick job his friend Jo (Carl Mohner) offers him, until he discovers that his old girlfriend Mado (Marie Sabouret) has become the lover of local gangster Pierre Grutter (Marcel Lupovici) during Tony's absence. Expanding a minor smash-and-grab into a full-scale jewel heist, Tony and his crew appear to get away clean, but their actions after the job is completed threaten the lives of everyone involved.",4.071187,/riZ2SXhTgllN6NWrPOJCtN4NrhG.jpg,1955-04-13,460226,122.0,Released,"[""Rififi""] ...means Trouble!",Rififi,False,7.7,90
False,60000000,http://www.shrek.com/,808,tt0126029,en,Shrek,"It ain't easy bein' green -- especially if you're a likable (albeit smelly) ogre named Shrek. On a mission to retrieve a gorgeous princess from the clutches of a fire-breathing dragon, Shrek teams up with an unlikely compatriot -- a wisecracking donkey.",17.987728,/140ewbWv8qHStD3mlBDvvGd0Zvu.jpg,2001-05-16,484409218,90.0,Released,The greatest fairy tale never told.,Shrek,False,7.3,4183
False,52500000,,824,tt0203009,en,Moulin Rouge!,"A celebration of love and creative inspiration takes place in the infamous, gaudy and glamorous Parisian nightclub, at the cusp of the 20th century. A young poet, who is plunged into the heady world of Moulin Rouge, begins a passionate affair with the club's most notorious and beautiful star.",13.691781,/xhuQz2yKPlWvMvvnf2u9RVkAQx6.jpg,2001-03-09,179213434,127.0,Released,No Laws. No Limits. One Rule. Never Fall In Love.,Moulin Rouge!,False,7.4,1348
False,140000000,,676,tt0213149,en,Pearl Harbor,"The lifelong friendship between Rafe McCawley and Danny Walker is put to the ultimate test when the two ace fighter pilots become entangled in a love triangle with beautiful Naval nurse Evelyn Johnson. But the rivalry between the friends-turned-foes is immediately put on hold when they find themselves at the center of Japan's devastating attack on Pearl Harbor on Dec. 7, 1941.",11.419388,/gzjMpcyV1RksWonaA87DZ8wQTH0.jpg,2001-05-21,449220945,183.0,Released,It takes a moment to change history. It takes love to change lives.,Pearl Harbor,False,6.6,1833
False,2000000,,966,tt0054047,en,The Magnificent Seven,An oppressed Mexican peasant village hires seven gunfighters to help defend their homes.,10.650752,/7w3JmmyL8GpBvW6BusQfQCSm2h0.jpg,1960-10-22,4905000,128.0,Released,They were seven - And they fought like seven hundred!,The Magnificent Seven,False,7.4,472
False,0,,301,tt0053221,en,Rio Bravo,"The sheriff of a small town in southwest Texas must keep custody of a murderer whose brother, a powerful rancher, is trying to help him escape. After a friend is killed trying to muster support for him, he and his deputies - a disgraced drunk and a cantankerous old cripple - must find a way to hold out against the rancher's hired guns until the marshal arrives. In the meantime, matters are complicated by the presence of a young gunslinger - and a mysterious beauty who just came in on the last stagecoach.",10.847383,/x0XFYNOAPROkYaYG8CeS75BJXxC.jpg,1959-03-17,5800000,141.0,Released,They fought back to back...No quarter given...No quarter asked...No way in...No way out...of Rio Bravo,Rio Bravo,False,7.6,265
False,0,,759,tt0045810,en,Gentlemen Prefer Blondes,"Lorelei Lee is a beautiful showgirl engaged to be married to the wealthy Gus Esmond, much to the disapproval of Gus' rich father, Esmond Sr., who thinks that Lorelei is just after his money. When Lorelei goes on a cruise accompanied only by her best friend, Dorothy Shaw, Esmond Sr. hires Ernie Malone, a private detective, to follow her and report any questionable behavior that would disqualify her from the marriage.",7.174547,/iH9AIwajzpaAmlPzQaoiLrumXED.jpg,1953-07-14,0,91.0,Released,The Two M-M-Marvels Of Our Age In The Wonder Musical Of The World!,Gentlemen Prefer Blondes,False,7.1,169
False,100000000,,644,tt0212720,en,A.I. Artificial Intelligence,"A robotic boy, the first programmed to love, David is adopted as a test case by a Cybertronics employee and his wife. Though he gradually becomes their child, a series of unexpected circumstances make this life impossible for David. Without final acceptance by humans or machines, David embarks on a journey to discover where he truly belongs, uncovering a world in which the line between robot and machine is both vast and profoundly thin.",13.249364,/wnUAcUrMRGPPZUDroLeZhSjLkuu.jpg,2001-06-29,235926552,146.0,Released,"David is 11 years old. He weighs 60 pounds. He is 4 feet, 6 inches tall. He has brown hair. His love is real. But he is not.",A.I. Artificial Intelligence,False,6.8,2011
False,0,http://www.tcm.com/tcmdb/title/24062/Sweet-Smell-of-Success/,976,tt0051036,en,Sweet Smell of Success,"New York City newspaper writer J.J. Hunsecker holds considerable sway over public opinion with his Broadway column, but one thing that he can't control is his younger sister, Susan, who is in a relationship with aspiring jazz guitarist Steve Dallas. Hunsecker strongly disproves of the romance and recruits publicist Sidney Falco to find a way to split the couple, no matter how ruthless the method.",5.196222,/dZBi7DSd3zjraZY1mxYeI5JohOr.jpg,1957-06-27,0,96.0,Released,The almighty J.J... the columnist with sixty million believers... his wrath is feared by the great and near great who worship the sweet smell of success!,Sweet Smell of Success,False,7.5,108
False,0,,2,tt0094675,fi,Ariel,"Taisto Kasurinen is a Finnish coal miner whose father has just committed suicide and who is framed for a crime he did not commit. In jail, he starts to dream about leaving the country and starting a new life. He escapes from prison but things don't go as planned...",3.860491,/gZCJZOn4l0Zj5hAxsMbxoS6CL0u.jpg,1988-10-21,0,69.0,Released,,Ariel,False,7.1,44
False,20000000,,505,tt0097626,en,Johnny Handsome,"A career criminal who has been deformed since birth is given a new face by a kindly doctor and paroled from prison. It appears that he has gone straight, but he is really planning his revenge on the man who killed his mentor and sent him to prison.",9.059459,/8NVYY7BH8OhPCRiIREB0SBu9Ly5.jpg,1989-09-12,7237794,94.0,Released,"They changed his looks, his life and his future... but they couldn't change his past .",Johnny Handsome,False,6.1,49
False,93000000,,331,tt0163025,en,Jurassic Park III,"In need of funds for research, Dr. Alan Grant accepts a large sum of money to accompany Paul and Amanda Kirby on an aerial tour of the infamous Isla Sorna. It isn't long before all hell breaks loose and the stranded wayfarers must fight for survival as a host of new -- and even more deadly -- dinosaurs try to make snacks of them.",0.648867,/26L7XODsNlxX3VwkfuUnYOslbRF.jpg,2001-07-18,368780809,92.0,Released,"This time, it's not just a walk in the park!",Jurassic Park III,False,5.7,2109
False,12000000,http://www.office-kitano.co.jp/brother/index.html,327,tt0222851,ja,Brother,"A Japanese Yakuza gangster’s deadly existence in his homeland gets him exiled to Los Angeles, California, where he is taken in by his little brother and his brother’s gang. This is the first English film by Takeshi Kitano.",8.134524,/zcnznSvHqAcLJ9Cm6XM202gS7yO.jpg,2000-09-09,15250000,114.0,Released,Are You Japanese?,Brother,False,6.8,107
False,100000000,,869,tt0133152,en,Planet of the Apes,"After a spectacular crash-landing on an uncharted planet, brash astronaut Leo Davidson finds himself trapped in a savage world where talking apes dominate the human race. Desperate to find a way home, Leo must evade the invincible gorilla army led by Ruthless General Thade.",17.319836,/uHp6PTo7SCrqdH5wCSrCCf8EQFX.jpg,2001-07-25,362211740,119.0,Released,You'll be sorry you were ever born human,Planet of the Apes,False,5.6,1270
False,0,http://www.brotundtulpen.de/,552,tt0237539,it,Pane e Tulipani,An endearing light comedy about a woman who spontaneously becomes a resident of Venice after her family left her begin. While enjoying the wonderful people she meets she achieves a new life and the first time independent of her family.,2.916247,/wQ9dfkjAWfFWhUCsI4FebVSMdt4.jpg,2000-03-03,0,114.0,Released,,Bread and Tulips,False,7.0,35
False,0,,249,tt0098621,en,The War of the Roses,"The Roses, Barbara and Oliver, live happily as a married couple. Then she starts to wonder what life would be like without Oliver, and likes what she sees. Both want to stay in the house, and so they begin a campaign to force each other to leave. In the middle of the fighting is D'Amato, the divorce lawyer. He gets to see how far both will go to get rid of the other, and boy do they go far.",5.963782,/jxHChKyDopLcDHvulDo4EVppCCr.jpg,1989-12-08,0,116.0,Released,Once in a lifetime comes a motion picture that makes you feel like falling in love all over again. This is not that movie.,The War of the Roses,False,6.7,288
False,6000000,,183,tt0098663,en,The Wizard,"Corey (Fred Savage) refuses to let his emotionally disturbed younger brother Jimmy (Luke Edwards) be institutionalized, and the two run away together. They soon join forces with a resourceful girl (Jenny Lewis), who notices that Jimmy has a special talent: he is a ""wizard"" at video games and can achieve the high score on absolutely everything he plays. Evading their parents and a sinister bounty hunter, the trio head for a climactic showdown at the national video game championships in California.",5.763954,/xGNirmikw9OXsfR9NYQKmsxb5nF.jpg,1989-12-15,14278900,100.0,Released,They're on a cross-country adventure to the world's greatest video championship. It's more than a game...it's the chance of a lifetime.,The Wizard,False,6.1,83
False,0,,742,tt0203166,sv,Tillsammans,"Elisabeth leaves her abusive and drunken husband Rolf, and goes to live with her brother, Göran. The year is 1975 and Göran lives in a commune called Together. Living in this leftist commune Elisabeth learns that the world can be viewed from different perspectives.",3.358638,/y6yk8fNyfXMJcviD6zxZE2qC0lJ.jpg,2000-08-25,0,106.0,Released,,Together,False,6.8,71
False,2900000,,248,tt0055312,en,Pocketful of Miracles,"Damon Runyon's fairytale, sweet and funny, is told by director Frank Capra. Boozy, brassy Apple Annie, a beggar with a basket of apples, is as much as part of downtown New York as old Broadway itself. Bootlegger Dave the Dude is a sucker for her apples --- he thinks they bring him luck. But Dave and girlfriend Queenie Martin need a lot more than luck when it turns out that Annie is in a jam and only they can help: Annie's daughter Louise, who has lived all her life in a Spanish convent, is coming to America with a Count and his son. The count's son wants to marry Louise, who thinks her mother is part of New York society. It's up to Dave and Queenie and their Runyonesque cronies to turn Annie into a lady and convince the Count and his son that they are hobnobbing with New York's elite.",2.649605,/4s5aoejcKbCawjESf2nCHIF67QZ.jpg,1961-12-18,5000000,136.0,Released,You have to see it to believe it!,Pocketful of Miracles,False,7.3,25
False,0,,166,tt0082100,fr,La Boum,"Le Boum is the story of a 13-year-old French girl dealing with moving to a new city and school in Paris, while at the same time her parents are getting a divorce.",12.105748,/1a7lRpHfOtmnvlbxLnt5mBk8RPA.jpg,1980-01-01,0,110.0,Released,,The Party,False,6.4,225
False,0,,570,tt0243255,fr,À ma sœur!,"Elena is 15, beautiful and flirtatious. Her less confident sister, Anais, is 12, and constantly eats. On holiday, Elena meets a young Italian student who is determined to seduce her. Anais is forced to watch in silence, conspiring with the lovers, but harboring jealousy and similar desires. Their actions, however, have unforeseen tragic consequences for the whole family.",2.063604,/lbVrGZtS0uZ23L0svFP98bgqvKg.jpg,2001-03-07,0,86.0,Released,"A new provocation from the director of ""Romance""",Fat Girl,False,6.2,44
