adult,budget,homepage,id,imdb_id,original_language,original_title,overview,popularity,poster_path,release_date,revenue,runtime,status,tagline,title,video,vote_average,vote_count
False,15000000,,951,tt0099938,en,Kindergarten Cop,"Hard-edged cop John Kimble gets more than he bargained for when he goes undercover as a kindergarten teacher to get the goods on a brutal drug lord while at the same time protecting the man's young son. Pitted against a class of boisterous moppets whose antics try his patience and test his mettle, Kimble may have met his match … in more ways than one.",3.67003,/7NkSMYuyVamvCnM5mYD6FkD59Wu.jpg,1990-12-21,201957688,111.0,Released,"Go ahead, you tell him you didn't do your homework.",Kindergarten Cop,False,5.8,643
False,9500000,,483,tt0100935,en,Wild at Heart,Young lovers Sailor and Lula run from the variety of weirdos that Lula's mom has hired to kill Sailor.,8.528622,/d4fbQjSSBd4FPyAROln1skafChr.jpg,1990-05-01,14560247,124.0,Released,A wild crazy love story.,Wild at Heart,False,7.0,341
False,2650000,,898,tt0055798,en,Birdman of Alcatraz,"After killing a prison guard, convict Robert Stroud faces life imprisonment in solitary confinement. Driven nearly mad by loneliness and despair, Stroud's life gains new meaning when he happens upon a helpless baby sparrow in the exercise yard and nurses it back to health. Despite having only a third grade education, Stroud goes on to become a renowned ornithologist and achieves a greater sense of freedom and purpose behind bars than most people find in the outside world.",4.471515,/sIzesANhTImFyeIdL0hrqMzgckG.jpg,1962-07-03,3100000,147.0,Released,Inside the rock called Alcatraz they tried to chain a volcano they called,Birdman of Alcatraz,False,7.0,71
False,0,,648,tt0038348,fr,La belle et la bête,"The story of a gentle-hearted beast in love with a simple and beautiful girl. She is drawn to the repellent but strangely fascinating Beast, who tests her fidelity by giving her a key, telling her that if she doesn't return it to him by a specific time, he will die of grief. She is unable to return the key on time, but it is revealed that the Beast is the genuinely handsome one. A simple tale of tragic love that turns into a surreal vision of death, desire, and beauty.",4.798852,/bhGxt2YxlyO7x4GpliHEzI28H0z.jpg,1946-10-29,0,96.0,Released,Once upon a time,Beauty and the Beast,False,7.8,133
False,100000,,618,tt0004972,en,The Birth of a Nation,"The Birth of A Nation is a silent film from 1915 and the highest grossing silent film in film history. The film tells a romance story during the American civil war. D.W. Griffith invested heavily in its high production values, pioneering many new camera effects. The Birth of a Nation was strongly protested for its negative portrayal of newly freed slaves (mostly white actors in blackface), which went on to create and propagate negative images of blacks of the early 20th century in the United States. The film was used as a recruiting propaganda by the KKK until the 1940s.",5.113205,/zYtgDRSOQeZmGbHkXff5CcEg05g.jpg,1915-02-08,11000000,193.0,Released,The fiery cross of the Ku Klux Klan.,The Birth of a Nation,False,6.4,109
False,531374,,995,tt0031971,en,Stagecoach,"A simple stagecoach trip is complicated by the fact that Geronimo is on the warpath in the area. The passengers on the coach include a drunken doctor, two women, a bank manager who has taken off with his client's money, and the famous Ringo Kid, among others.",7.970462,/wvyS90AJsztvX5wxpDSjURad9yl.jpg,1939-03-02,1103757,96.0,Released,Danger holds the reins as the devil cracks the whip! Desperate men! Frontier women! Rising above their pasts in a West corrupted by violence and gun-fire!,Stagecoach,False,7.6,216
False,5500000,https://www.warnerbros.com/bullitt,916,tt0062765,en,Bullitt,"Senator Walter Chalmers is aiming to take down mob boss Pete Ross with the help of testimony from the criminal's hothead brother Johnny, who is in protective custody in San Francisco under the watch of police lieutenant Frank Bullitt. When a pair of mob hitmen enter the scene, Bullitt follows their trail through a maze of complications and double-crosses. This thriller includes one of the most famous car chases ever filmed.",7.01973,/oyhnoFu2oKQfAIdu9YU8I8Ne0pX.jpg,1968-10-17,42300873,113.0,Released,"There are bad cops, good cops - and then there's Bullitt.",Bullitt,False,7.0,273
False,31000000,,79,tt0299977,zh,英雄,One man defeated three assassins who sought to murder the most powerful warlord in pre-unified China.,9.861765,/xkJnow23eDxwQXB0iIWAWkBF47y.jpg,2002-12-19,177394432,99.0,Released,One man's strength will unite an empire.,Hero,False,7.3,647
False,4000000,,987,tt0071524,en,The Front Page,A journalist suffering from burn-out wants to finally say goodbye to his office – but his boss doesn’t like the idea one bit.,5.789565,/x8jYmf9Y8npVGojZDE7Bnrtrfbt.jpg,1974-12-01,0,105.0,Released,,The Front Page,False,6.9,69
False,1000000,http://movies.disney.com/nausicaa-of-the-valley-of-the-wind,81,tt0087544,ja,風の谷のナウシカ,"After a global war, the seaside kingdom known as the Valley Of The Wind remains one of the last strongholds on Earth untouched by a poisonous jungle and the powerful insects that guard it. Led by the courageous Princess Nausicaa, the people of the Valley engage in an epic struggle to restore the bond between humanity and Earth.",11.267366,/hnYowHwLq0iUWriAHtiiCWsI2dP.jpg,1984-03-11,3301446,117.0,Released,,Nausicaä of the Valley of the Wind,False,7.7,808
False,0,,827,tt0046911,fr,Les diaboliques,"In this classic of French suspense, the cruel and abusive headmaster of a boarding school, Michel Delassalle, becomes the target of a murder plot hatched by an unlikely duo -- his meek wife and the mistress he brazenly flaunts. The women, brought together by their mutual hatred for the man, pull off the crime but become increasingly unhinged by a series of odd occurrences after Delassalle's corpse mysteriously disappears.",6.028408,/mNaL2CFsABXJKmnst1V2X2Or3Go.jpg,1955-01-29,0,116.0,Released,"See it, be amazed at it, but... BE QUIET ABOUT IT!",Diabolique,False,7.9,198
False,350000,,255,tt0062695,fr,Baisers volés,"Baisers voles is the second of two films from the ‘Antonie-Doinel-Zyklus’ by French director Truffaut. The film depicts the life of a young twenty year old man who’s life revolves around casual jobs and women, especially young violinist Christine Darbon (Claude Jade's screen-debut).",6.564465,/5e1TrGnnBwF2cZIFUDZ63KNls5K.jpg,1968-08-13,0,96.0,Released,Antoine knows what he wants to do... his problem is doing it,Stolen Kisses,False,7.4,59
False,140000000,,616,tt0325710,en,The Last Samurai,"Nathan Algren is an American hired to instruct the Japanese army in the ways of modern warfare, which finds him learning to respect the samurai and the honorable principles that rule them. Pressed to destroy the samurai's way of life in the name of modernization and open trade, Algren decides to become an ultimate warrior himself and to fight for their right to exist.",19.582325,/sLv5pXysIz7QbtKFJy85d5yxv2W.jpg,2003-12-05,456758981,154.0,Released,"In the face of an enemy, in the heart of one man, lies the soul of a warrior.",The Last Samurai,False,7.3,1946
False,70000000,,587,tt0319061,en,Big Fish,"Throughout his life Edward Bloom has always been a man of big appetites, enormous passions and tall tales. In his later years, he remains a huge mystery to his son, William. Now, to get to know the real man, Will begins piecing together a true picture of his father from flashbacks of his amazing adventures.",14.739983,/6DRFdlNZpAaEt7eejsbAlJGgaM7.jpg,2003-12-25,122919055,125.0,Released,An adventure as big as life itself.,Big Fish,False,7.6,2064
False,94000000,http://www.lordoftherings.net,122,tt0167260,en,The Lord of the Rings: The Return of the King,"Aragorn is revealed as the heir to the ancient kings as he, Gandalf and the other members of the broken fellowship struggle to save Gondor from Sauron's forces. Meanwhile, Frodo and Sam bring the ring closer to the heart of Mordor, the dark lord's realm.",29.324358,/uexxR7Kw1qYbZk0RYaF9Rx5ykbj.jpg,2003-12-01,1118888979,201.0,Released,The eye of the enemy is moving.,The Lord of the Rings: The Return of the King,False,8.1,8226
False,8000000,,504,tt0340855,en,Monster,Aileen Wuornos is an emotionally scarred highway hooker who shoots a sadistic trick who rapes her and ultimately becomes America's first female serial killer.,7.189024,/uIVrPwor7fgSm5MRMj8IWs76gpk.jpg,2003-11-16,60378584,110.0,Released,The first female serial killer of America,Monster,False,7.0,500
False,0,,427,tt0050706,fr,Mon oncle,With many idea rich comic situations French director Jacques Tati uses his poetic ways and knowledge of the discrepancy between heart and technique to tell a gentle business satiric tale that won him the Oscar for best foreign film in 1959.,11.06066,/wH6RyPiXFy8INLbViVkchLVOmBc.jpg,1958-05-10,0,110.0,Released,Mr. Hulot Ventures Into Suburbia...And Disrupts...Disassembles...And Demolishes With His Very Subtle Satire,Mon oncle,False,7.3,98
False,0,,778,tt0046487,fr,Les Vacances de Monsieur Hulot,"Monsieur Hulot comes to a beachside hotel for a vacation, where he accidentally (but good-naturedly) causes havoc.",4.328916,/r4F4tsU0Ajeh9ZYUkWOJSYmioj7.jpg,1953-02-26,0,84.0,Released,It's laugh-vacation time as Jacques Tati romps through the most gloriously mad lark ever to tickle the ribs of young and old alike!,Monsieur  Hulot's Holiday,False,7.3,76
False,0,,980,tt0036244,en,The Ox-Bow Incident,"Gil Carter and Art Croft ride into a small Nevada town plagued by cattle thieves. Initially suspected of being the rustlers themselves, Carter and Croft eventually join a posse out to get the criminals, who also may be involved in a recent shooting. When the posse closes in on a group that could be the fugitives, they must decide on a course of action, with numerous lives hanging in the balance.",5.546182,/bCuK2h4tizhCWpQT51y1wmca8DY.jpg,1943-03-11,0,75.0,Released,Tough! True! Terrifying!,The Ox-Bow Incident,False,7.9,71
False,0,,405,tt0047528,it,La strada,"A traveling strongman, Zampano, repays the death of Rosa, his assistant, by offering the same job to little sister Gelsomina,  whose mother receives compensation in return.",5.948021,/lU2gLjPCPdtWWqSRHZ9EqPwrbNQ.jpg,1954-07-16,0,104.0,Released,You've been hearing about a great picture called La Strada (The Road)...now it is here!,La Strada,False,7.5,196
False,0,http://www.sonyclassics.com/ibrahim/aboutcast.html,337,tt0329388,fr,Monsieur Ibrahim et les fleurs du Coran,Monsieur Ibrahim is a story about a young Jewish boy in Paris who meets an old Muslim Turkish grocery store owner. The film touches the themes of friendship and love as the old man is a father figure to the boy as he teaches him of the Koran. The film is based on a book of the popular book by the French author Eric-Emmanuel Schmitt.,8.260823,/vOPzRgy6rTVDkGYb477lEwD2owh.jpg,2003-12-03,11576431,94.0,Released,,Monsieur Ibrahim,False,7.0,39
False,30000000,http://www.thepassionofthechrist.com/,615,tt0335345,en,The Passion of the Christ,"""The Passion of the Christ"" is a film about the last 12 hours in the life of Jesus. Director Mel Gibson received much criticism from critics and audiences for his explicit depiction of and focus on violence and on christs suffering, especially on the part of the jewish community. The films languages are Arabic, Latin and Hebrew and its actors are laymen which was controversially received as well.",13.194168,/oFuLM1EaKhi1WNWiTjQ1HKIZ1Eg.jpg,2004-02-25,611899420,127.0,Released,"By his wounds, we were healed.",The Passion of the Christ,False,6.9,888
False,4800000,http://www.good-bye-lenin.de/index2.php,338,tt0301357,de,"Good bye, Lenin!",An affectionate and refreshing East/West-Germany comedy about a boy who’s mother was in a coma while the Berlin wall fell and when she wakes up he must try to keep her from learning what happen (since she was an avid communist supporter) to avoid shocking her which could lead to another heart attack.,10.605595,/pb62NJ3tRxgmxBSM9u1Wg1dmmvG.jpg,2003-02-09,79384880,121.0,Released,The German Democratic Republic lives on -- in 79 square meters!,"Good bye, Lenin!",False,7.4,602
False,0,,797,tt0060827,sv,Persona,"A young nurse, Alma, is put in charge of Elisabeth Vogler: an actress who is seemingly healthy in all respects, but will not talk. As they spend time together, Alma speaks to Elisabeth constantly, never receiving any answer. Alma eventually confesses her secrets to a seemingly sympathetic Elisabeth and finds that her own personality is being submerged into Elisabeth's persona.",8.862628,/cjAnlvCrp9ZY7atASUsxRrhve7o.jpg,1966-10-18,0,85.0,Released,,Persona,False,8.0,353
False,0,,156,tt0329767,da,Wilbur begår selvmord,"The strange comedy film of two close brothers; one, Wilbur, who wants to kill himself, and the other, Harbour, who tries to prevent this. When their father dies leaving them his bookstore they meet a woman who makes their lives a bit better yet with a bit more trouble as well.",2.651412,/naC1ANPfaKw89kGalme2BrxRCA2.jpg,2002-11-08,0,111.0,Released,Meet a man dying to live,Wilbur Wants to Kill Himself,False,6.8,25
False,28000000,http://www.dawnofthedeadmovie.net/,924,tt0363547,en,Dawn of the Dead,"A group of surviving people take refuge in a shopping center after the world has been over taken over by aggressive, flesh-eating zombies. A remake of the 1978 zombie film of the same name.",13.157873,/yfqsgzW6AQYmBjIEIq0y9EB1Rgl.jpg,2004-03-19,102356381,101.0,Released,"When the undead rise, civilization will fall.",Dawn of the Dead,False,6.8,1039
False,20000000,http://www.eternalsunshine.com,38,tt0338013,en,Eternal Sunshine of the Spotless Mind,"Joel Barish, heartbroken that his girlfriend underwent a procedure to erase him from her memory, decides to do the same. However, as he watches his memories of her fade away, he realises that he still loves her, and may be too late to correct his mistake.",12.906327,/7y3eYvTsGjxPYDtSnumCLIMDkrV.jpg,2004-03-19,72258126,108.0,Released,You can erase someone from your mind. Getting them out of your heart is another story.,Eternal Sunshine of the Spotless Mind,False,7.9,3758
False,10000000,,553,tt0276919,da,Dogville,"A barren soundstage is stylishly utilized to create a minimalist small-town setting in which a mysterious woman named Grace hides from the criminals who pursue her. The town is two-faced and offers to harbor Grace as long as she can make it worth their effort, so Grace works hard under the employ of various townspeople to win their favor. Tensions flare, however, and Grace's status as a helpless outsider provokes vicious contempt and abuse from the citizens of Dogville.",9.808595,/g1xLrof2RVgtHBB4fLvR5Xr8l5x.jpg,2003-05-19,16680836,178.0,Released,A quiet little town not far from here.,Dogville,False,7.6,619
False,650000,,923,tt0077402,en,Dawn of the Dead,"During an ever-growing epidemic of zombies that have risen from the dead, two Philadelphia SWAT team members, a traffic reporter, and his television-executive girlfriend seek refuge in a secluded shopping mall.",19.24201,/8D6WEfNZr6JadQrqJr5OOq1QlV0.jpg,1978-09-02,55000000,127.0,Released,"When there's no more room in hell, the dead will walk the earth.",Dawn of the Dead,False,7.4,597
False,30000000,,393,tt0378194,en,Kill Bill: Vol. 2,"The Bride unwaveringly continues on her roaring rampage of revenge against the band of assassins who had tried to kill her and her unborn child. She visits each of her former associates one-by-one, checking off the victims on her Death List Five until there's nothing left to do … but kill Bill.",21.533072,/au9lFA5a2ZnBKCzPbZQf00r7J64.jpg,2004-04-16,152159461,136.0,Released,The bride is back for the final cut.,Kill Bill: Vol. 2,False,7.7,4061
False,6400000,http://www.sonyclassics.com/youngadam/,237,tt0289635,en,Young Adam,A young drifter working on a river barge disrupts his employers' lives while hiding the fact that he knows more about a dead woman found in the river than he admits.,5.235419,/eZDKfjjI5IhqKCOLHonTvKpPnNr.jpg,2003-09-26,2500000,93.0,Released,Everyone has a past. Everyone has a secret.,Young Adam,False,5.9,46
False,175000000,,652,tt0332452,en,Troy,"In year 1250 B.C. during the late Bronze age, two emerging nations begin to clash. Paris, the Trojan prince, convinces Helen, Queen of Sparta, to leave her husband Menelaus, and sail with him back to Troy. After Menelaus finds out that his wife was taken by the Trojans, he asks his brother Agamemnom to help him get her back. Agamemnon sees this as an opportunity for power. So they set off with 1,000 ships holding 50,000 Greeks to Troy. With the help of Achilles, the Greeks are able to fight the never before defeated Trojans.",15.387275,/edMlij7nw2NMla32xskDnzMCFBM.jpg,2004-05-13,497409852,163.0,Released,For passion. For honor. For destiny. For victory. For love.,Troy,False,6.9,2841
False,0,http://www.coffeeandcigarettesmovie.com/,883,tt0379217,en,Coffee and Cigarettes,Coffee And Cigarettes is a collection of eleven films from cult director Jim Jarmusch. Each film hosts star studded cast of extremely unique individuals who all share the common activities of conversing while drinking coffee and smoking cigarettes.,5.32553,/myLbZRsgRVyfj1luCvUcgB9cjGs.jpg,2003-09-05,7897645,96.0,Released,,Coffee and Cigarettes,False,6.9,216
False,0,,132,tt0065780,en,The Rolling Stones: Gimme Shelter,"This documentary of the Rolling Stones' 1969 US tour has become a legendary, harrowing symbol of the tragic demise of the ""Peace and Love"" era. After a successful tour across the US, the Rolling Stones gave a free December concert at Altamont Speedway in California with the Grateful Dead, Ike and Tina Turner, Jefferson Airplane, and the Flying Burrito Brothers. The band unwisely selected the Hells Angels to provide security, and the bikers resorted to violence to keep the stoned, restless, and often naked crowd in line. The result: dozens of injuries and the on-screen stabbing of a young black man (during ""Sympathy for the Devil"") by one of the concert's staff security. In a manipulative but effective move, the Maysles brothers filmed Mick Jagger in the editing room witnessing the on-camera murder for the first time. The film also works as a rock-and-roll document, capturing the band at their most relaxed, intoxicating, and electrifying.",2.336022,/3UR6YSrz1nIQ84inth4emIPcEOT.jpg,1970-12-06,0,91.0,Released,"Landmark film follows the Rolling Stones on their notorious 1969 U.S. tour, culminating in tragedy at San Francisco's Altamont Speedway.",The Rolling Stones: Gimme Shelter,False,7.8,42
False,0,,502,tt0058083,en,Fail-Safe,Because of a technical defect an American bomber team mistakenly orders the destruction of Moscow. The President of the United States has but little time to prevent an atomic catastrophe from occurring. Director Sidney Lumet gives an atmospheric vision of the future with a Cold War backdrop.,4.225974,/gp2b35iSQ03kKZgPpeeOuSb0Ra2.jpg,1964-10-07,0,112.0,Released,It will have you sitting on the brink of eternity!,Fail-Safe,False,7.6,83
False,9500000,http://www.mgm.com/view/movie/2347/You-Only-Live-Twice/,667,tt0062512,en,You Only Live Twice,A mysterious space craft kidnaps a Russian and American space capsule and brings the world on the verge of another World War. James Bond investigates the case in Japan and meets with his archenemy Blofeld. The fifth film from the legendary James Bond series starring Sean Connery as the British super agent.,10.359669,/7dnsJZniZK1Hbc9mOFDYa5W0dHi.jpg,1967-06-12,111584787,117.0,Released,You Only Live Twice...and Twice is the only way to live!,You Only Live Twice,False,6.5,541
False,27500000,http://www.mgm.com/view/movie/1394/Octopussy/,700,tt0086034,en,Octopussy,James Bond is sent to investigate after a fellow “00” agent is found dead with a priceless Farberge egg. James bond follows the mystery and uncovers a smuggling scandal and a Russian General who wants to provoke a new World War.,10.619302,/s1GeJcwTclopbed1Bo2hjunSika.jpg,1983-06-05,187500000,131.0,Released,James Bond’s all time high.,Octopussy,False,6.2,534
False,2300000,,633,tt0076734,nl,Soldaat van Oranje,"This film depicts World War II through the eyes of several Dutch students. It follows them through the beginning of the war, the Nazi occupation and the liberation.",2.348745,/87TIQ9gjPRAO1NZaBj9wOjubcq8.jpg,1977-09-22,0,149.0,Released,,Soldier of Orange,False,7.4,39
False,350000,,294,tt0089015,en,Desert Hearts,The story of straight-edge literature professor Vivian who travels to Reno to get away from a relationship breakup when she falls in love with an attractive and unconventional girl named Cay.,1.553107,/vlQBjV04m8Xb6G1LuDYjtm0IB9p.jpg,1985-10-01,2400000,96.0,Released,,Desert Hearts,False,6.7,21
False,5900000,https://www.sonymoviechannel.com/movies/china-syndrome,988,tt0078966,en,The China Syndrome,"While doing a series of reports on alternative energy sources, an opportunistic reporter Kimberly Wells witnesses an accident at a nuclear power plant. Wells is determined to publicise the incident but soon finds herself entangled in a sinister conspiracy to keep the full impact of the incident a secret.",4.621214,/u0tbxqq0krtGMWnuycmikHPQ22Z.jpg,1979-03-16,51718367,122.0,Released,Sometimes it’s too late to tell the truth.,The China Syndrome,False,7.0,99
False,0,,204,tt0046268,fr,Le salaire de la peur,"In the South American jungle, supplies of nitroglycerine are needed at a remote oil field. The oil company pays four men to deliver the supplies in two trucks. A tense rivalry develops between the two sets of drivers on the rough remote roads where the slightest jolt can result in death.",7.643793,/3IGuAr1xsErR4XqmHZcfyQ4f8KY.jpg,1953-04-22,0,147.0,Released,Dynamic Tremendous Shattering,The Wages of Fear,False,7.9,176
False,0,,781,tt0120522,de,Winterschläfer,"Young blonde translator Rebecca lives with her boyfriend ski instructor Marco in a mountain villa owned by her friend, nurse Laura. Rene, local cinema projectionist, steals Marco's car and gets into a car crash with local Theo, whose daughter, after being in coma for a time, dies. Rene suffers from partial short term memory loss and starts a relationship with Laura. Meanwhile Marco is looking for the man who stole his car and Theo - for the man who killed his daughter...",1.781979,/nEzRPU5RhMBczgJxqmcDXkGWuuD.jpg,1997-10-30,0,120.0,Released,,Wintersleepers,False,6.7,10
False,0,,465,tt0094596,fr,36 Fillette,"Lili, a pouty and voluptuous 14-year-old, is caravan camping with her family in Biarritz. She's self-aware and holds her own in a café conversation with a concert pianist she meets, but she has a wild streak and she's testing her powers over men, finding that she doesn't always control her moods or actions, and she's impatient with being a virgin. She sets off with her brother to a disco, latching onto an aging playboy who is himself hot and cold to her. She is ambivalent about losing her virginity that night, willing the next, and determined by the third. The playboy's mix of depression and misogyny ends their unconsummated affair, so Lili has to hunt elsewhere.",3.200299,/9nOr9of8cIOT90Rmm15HG6cjvsF.jpg,1988-03-03,0,88.0,Released,,Junior Size 36,False,5.3,4
False,20000000,http://www.scifi.com/dune_2k/,876,tt0142032,en,Frank Herbert's Dune,"A three part mini-series based on Frank Herbert's classic Science Fiction novel entailing politics, betrayal, lust, greed and the coming of a Messiah.",14.612842,/xhLPh6po1r1qDnemdCj8pGS2MvG.jpg,2000-12-03,0,292.0,Released,Discover the greatest treasure in the universe.,Frank Herbert's Dune,False,6.7,114
False,0,,336,tt0067140,it,Giù la testa,"At the beginning of the 1913 Mexican Revolution, greedy bandit Juan Miranda and idealist John H. Mallory, an Irish Republican Army explosives expert on the lam from the British, fall in with a band of revolutionaries plotting to strike a national bank. When it turns out that the government has been using the bank as a hiding place for illegally detained political prisoners -- who are freed by the blast -- Miranda becomes a revolutionary hero against his will.",9.611094,/xkLaMyxUgWqmWYAw578p4HXSUDk.jpg,1971-10-20,0,157.0,Released,Rod Steiger and James Coburn will blow you apart in,"Duck, You Sucker",False,7.7,176
False,0,,222,tt0017668,de,Berlin: Die Sinfonie der Grosstadt,Berlin is Walter Ruttmanns black and white documentary of Berlin in 1927. The big city symphony shows a day in the life of metropolitan Berlin. Showing the industrial uprising as well as the lives and working circumstances of the time.,0.692745,/ePGMsItIMHSOvZkCJ6rnl4v64Sq.jpg,1927-09-23,0,69.0,Released,,Berlin: Symphony of a Great City,False,8.0,11
False,0,http://www.fruehling-sommer.de,113,tt0374546,ko,봄 여름 가을 겨울 그리고 봄,"This South Korean film takes place on an isolated lake, where an old monk lives in a small floating temple. The monk has a young boy living with him, learning to become a monk. We watch as seasons and years pass by.",8.157887,/uYQwUyHBKLPmCqUc9wMdphiphW2.jpg,2003-09-19,6502364,103.0,Released,"Spring, Summer, Autumn, Winter... and Spring","Spring, Summer, Fall, Winter... and Spring",False,7.6,240
False,500000,,203,tt0070379,en,Mean Streets,"A small-time hood must choose from among love, friendship and the chance to rise within the mob.",8.212399,/3awGnJPs7XmGyCB2eFdxVm6GlGd.jpg,1973-10-02,3000000,110.0,Released,You don't make up for your sins in church. You do it in the streets...,Mean Streets,False,7.2,359
